,job_titles,companys,employment_type,seniority,industrys,salary,salary_terms,job_descriptions,job_requirements,links,location,gov_support
137,Lecturer - Electronics (Internet of Things (IoT) & Communication),Institute of Technical Education,Contract,Executive,"Information Technology, Public / Civil Service","$3,000to$6,000",Monthly,"Responsibilities As a Lecturer, your contributions go beyond teaching and facilitating learning. You play a critical role in recognising and nurturing your students’ potential and their lifelong learning needs. In addition, you will carry out industry or consultancy projects to help you remain relevant in your profession and to evolving changes in industry, and maintain strong linkages with industry and schools. You will also have the opportunity to have industry attachments or experience on a regular basis to update your skills, knowledge and practices of your profession. Those with good and relevant experience can look forward to Senior Lecturer or equivalent positions, with career development opportunities to leadership positions in the Colleges or Headquarters.Requirements College Central   You should be trained in Electronics Engineering, Computer Science, Computer Engineering, IoT related subjects, with at least 3 years of relevant experience in design, develop and deployment of embedded firmware for IoT & Communication hardware and software.   You should be familiar in one or more of the following areas:  - roduct electronics design related to analogue, digital and power electronics - PCB Cad design software rules and routing - programming skills on C, C++ or python  - IoT/Cloud development and data visualization - electronics assembly and hardware     College East You should be trained in Information Technology, Computer Science, Data Science and/or Analytics, with at least 3 years of relevant work experience to be able to develop students' skills in implementing IoT/software applications, including data analytics solutions. You should possess relevant experience in one or more of the following areas: - development of IoT applications - data analytics technologies and Big Data - proficiency in programming languages such as Python, R or similar (familiarity with Python-based libraries such as scikit-learn, numpy/scipy and pandas is preferred) - programming web and mobile applications would be advantageous    ",,https://www.mycareersfuture.sg/job/lecturer-electronics-communication-institute-technical-education-24b8f8766d5ddff9b94e71a34f3b3387,,
138,Data Scientist,AVENSYS CONSULTING PTE. LTD.,Permanent,Professional,Information Technology,"$3,500to$5,500",Monthly," 1 – 5 years of experience in Data Science or Data Analytics Have worked and deployed on technologies such as AWS, Azure, Google Cloud, Hadoop, RDBMS, MongoDB, NoSQL, Hive, ETL, NLP, AI, ML and/or DL Experience with Python or C++ programming language. Experience with Big Data architectures will be advantageous Have passion and enthusiasm to master new technology Lateral thinking, passionate, innovative and creative. A highly motivated self-starter who possess positive mindset, a doer mentality, proactive and good communication skills Ability to work in a fast-paced and dynamic environment     ",Requirements1 – 5 years of experience in Data Science or Data Analytics,https://www.mycareersfuture.sg/job/data-scientist-avensys-consulting-bbe20da6fbf546bd919bfdb446f50e71,Islandwide,Government support available
139,Senior Research Fellow (Institute of Data Science),NATIONAL UNIVERSITY OF SINGAPORE,Contract,Non-executive,Sciences / Laboratory / R&D,"$72,000to$140,000",Annually,"The Senior Research Fellow will be responsible for undertaking in-depth research and innovation in data science, machine learning, artificial intelligence and big data that lead to publications in top-tier international conferences and journals, as well as real-world implementations. He/she will be working closely with the Principal Investigator and lab members on one or more research projects with external collaborators on interesting and challenging real-world datasets and problem statements.  He/she will also work with the Principal Investigator to develop new research programmes and craft new funding proposals, and assist in mentoring junior researchers and students in research projects. Responsibilities: ·         Develop and implement new concepts and algorithms in data science, machine learning and artificial intelligence ·         Research and be up-to-date on state-of-the-art methodologies in related technical fields and application domains ·         Assist in developing new research programmes and crafting funding proposals ·         Mentor and/or supervise junior researchers and students in research projects ·         Contribute to knowledge exchange and knowledge transfer activities with external partners and collaborators ·         Writing or contributing to publications for disseminating research findings ·         Develop demos and presentations for exhibiting work at appropriate events.","Requirements A PhD in Computer Science or equivalent, with specialization related to data mining, machine learning, artificial intelligence, or databases; At least 3 years of postdoctoral research experience, as well as a demonstrated capability to achieve research excellence and develop research programmes and funding proposals; Computational thinking with proven ability to conduct independent research with a strong and relevant publication record; Experienced in working with a diverse range of data types using state-of-the-art machine learning and AI algorithms on big data platforms – prior experience in data analytics and machine learning for healthcare applications would be a plus; Excellent interpersonal communication and oral presentation skills in English; Experienced in mentoring and supervising students and junior researchers, and Experienced in working in a team, with people of diverse skillsets, including industry end-users ",https://www.mycareersfuture.sg/job/senior-research-fellow-national-university-singapore-426ae488b7603cc178f66da18f3a5f41,South,
140,Data Engineers ( Renewable Contract Roles ),CAPGEMINI SINGAPORE PTE. LTD.,"Contract, Full Time","Professional, Executive, Junior Executive",Information Technology,"$3,800to$9,000",Monthly,"We are looking for Data Engineers for Capgemini Singapore on renewable contracts : Contract period (renewable): 5X for 6 months renewable contract 5X for 12 months renewable contract To start soonest possible. 1 month notice period is fine. Competent in any 2 or more of the following technology:  RDBMS: Oracle, Postgres, MSSQL, Netezza ETL and Data Integration Tools: IBM Datastage, Pentaho, Talend, Attunity Big Data: Hadoop (Hortonworks), Hive QL, Spark, Sqoop, etc Programming and Scripting: Linux/Unix Shell Scripting, Java, Scala, Hive QL, PL/SQL, NoSQL BI Tools: PowerBI, Qlik     ","RequirementsWorking Experience:  Min 3-5 years in data engineering and modelling. Experience in designing and developing dataware house solutions Hands on in managing data mapping, data quality and integrity, performance in data processing. Experience in insurance domain is an advantage Experience in Agile software development    Personal Traits  Proactive with can-do attitude Independent and self-motivated Able to work under pressure to meet tight timeline Able to provide regular updates ",https://www.mycareersfuture.sg/job/data-engineers-capgemini-singapore-e6ae19711b4cfa9a014051730425d7a9,Islandwide,Government support available
141,Data Engineer,DATAROBOT SINGAPORE PTE. LTD.,Permanent,Professional,Information Technology,"$100,000to$160,000",Annually,"Data Engineer Singapore DataRobot is looking for an experienced software engineer to join our team working on Big Data problems.  As a team member, you will work on building a data processing framework that allows the DataRobot application to scale to new heights. The ideal candidate should have experience in distributed computing and storage architectures and be able to think at scale.","Requirements Bachelor's degree in Computer Science, Engineering, or related field 5+ years experience building large scale, highly available, distributed computing systems 1+ years experience in Scala or Java  2+ years experience working in the Hadoop stack (HDFS, Yarn, ZooKeeper, etc.) 3+ years experience in Python. Fundamental knowledge of data structures, algorithms, and complexity analysis Ability to expertly design and produce high quality, high performance code ready to ship Hands on experience with Big Data technologies (e.g. Hadoop MapReduce, Spark, Hive, Vertica, Netezza, Greenplum, Aster) Familiarity with internals of distributed data processing engines such as Spark Ability to evaluate and optimize performance and scalability in the context of big data processing and storage. Experience working in GNU/Linux environments Understanding of software design principles and best practices (test driven development, source control management) Open minded, curious, and thorough. Proficient in English ",https://www.mycareersfuture.sg/job/data-engineer-datarobot-singapore-b1f81a36ee1f58095e92b7f8df51dc55,Central,Government support available
142,"Manager, Value Driven Office",NATIONAL UNIVERSITY HEALTH SYSTEM PTE. LTD.,Full Time,Manager,General Management,Salary undisclosed,,"As Manager in AIO - Value Drive Office (VDO), you will assist in planning, managing and implementing Health Informatics and data analytics for value driven outcome projects in NUHS. You will work closely with various departments to identify and/or support them to drive value creation in their current workflow. Job Responsibilities  Coordinate VDO projects’ activities and project meetings. Facilitate monthly meetings with Senior Management. Assign, track and monitor VDO team members in their project deliverable and timeliness of completion of key tasks. Conduct data and VDO dashboard verifications and consolidate VDO data for reporting purposes. Perform big data analysis, draw insights and engage stakeholders in providing possible solutions. ","Requirements Minimum Bachelor’s degree in Computer Science, Mathematics, Economics, Information Management, Accounting or Statistics. At least 6 years of relevant experience in finance, auditing, analytics, or technology related field. Good interpersonal skills, a detail-oriented & flexible person who can work across different areas within the team. Proficient in the use of MS Excel (advance), Data Visualization tools (e.g. Tableau, IDEAs), SQL and Sharepoint. Strong analytical skills with an ability to apply business logic to design and implement data mining techniques on large data sets. Possess strong problem solving and critical thinking skills and comfortable to work in an ambiguity environment. Working knowledge of data mining and forecasting/predictive modeling tools and techniques will be preferred. Ability to deliver clear, concise reports and presentations/dashboards with an ability to effectively articulate observations and recommendations. Have a proven track record of building strong relationships with stakeholders at various levels. Can-do attitude and ability to work independently. ",https://www.mycareersfuture.sg/job/manager-value-driven-office-national-university-health-system-095002370a8890c6872924cf8a4b75da,South,
143,"Research Engineer (Cyber Security&Intelligence), I2R / A*STAR",A*STAR RESEARCH ENTITIES,"Contract, Full Time",Professional,Sciences / Laboratory / R&D,"$2,500to$5,000",Monthly,"About the Institute for Infocomm Research (I²R) The Institute for Infocomm Research (I²R) is a member of the Agency for Science, Technology and Research (A*STAR) family and is Singapore’s largest ICT research institute. Our strategic thrusts are in the spheres of intelligence, communications and media and our research capabilities are in shared sensor networks, public-public/public-private data-sharing platform, big data analytics and visualization solutions. For more information about I2R, please visit www.i2r.a-star.edu.sg Successful candidate will work with a team to conduct exciting R&D on multimedia security, in one or more of the following areas: tampering detection, data hiding, security intelligence and analytics, pattern recognition, machine learning & analytics. Successful candidate will be involved in researching and developing advanced technologies and algorithms to detect, analyse, and assess data related to anomalies in image/audio/video signals.               ","Requirements    Minimum Bachelor Degree in Computer Science, Computer Engineering, Information Security or other related fields   Experienced in multimedia security, computer vision, image/video processing, machine learning will be a plus   Proficient in at least one programming language of Python, C, C++ and Matlab   Highly motivated, resourceful, with good attitude   Ability to deliver under tight schedules   Good interpersonal, presentation and communication skills   The above eligibility criteria are not exhaustive. A*STAR may include additional selection criteria based on its prevailing recruitment policies. These policies may be amended from time to time without notice. We regret that only shortlisted candidates will be notified.",https://www.mycareersfuture.sg/job/research-engineer-i2r-astar-astar-research-entities-b01adb9f3a76659e1e784f506f250c25,South,
144,Research Engineer (Human language Technologies) /  I2R (A*STAR),A*STAR RESEARCH ENTITIES,"Contract, Full Time",Professional,Sciences / Laboratory / R&D,"$2,500to$5,000",Monthly,"About Institute for Infocomm Research (I²R)  The Institute for Infocomm Research (I²R) is a member of the Agency for Science, Technology and Research (A*STAR) family and is Singapore’s largest ICT research institute. Our strategic thrusts are in the spheres of intelligence, communications and media and our research capabilities are in shared sensor networks, public-public/public-private data-sharing platform, big data analytics and visualisation solutions. For more information about I²R, please visit www.i2r.a-star.edu.sg ﻿We are looking for a highly-motivated and skilled research engineer to work on real-world text data analysis, processing and classificaiton.   He/she will work with a team of scientists with core responsibilities to fulfill research tasks and deliverables.  He/she will learn the state of- the-art in the relevant research fields and have the opportunity to solve real-world challenging problems in the medical data domain.","Requirements Minimum Bachelor Degree in Computer Science, Engineering and Electronics, Mathematics or other related fields Good programming experiences and capabilities in python and shell script, c shar or Java  Experience in text data analysis and processing, machine learning. Experience in deep learning is an added advantage  The above eligibility criteria are not exhaustive. A*STAR may include additional selection criteria based on its prevailing recruitment policies. These policies may be amended from time to time without notice. We regret that only shortlisted candidates will be notified",https://www.mycareersfuture.sg/job/research-engineer-i2r-astar-research-entities-6f25c0457a41aaa40b96f1072cbd7d48,South,
145,"Research Engineer (Data Analytics), I2R (A*STAR)",A*STAR RESEARCH ENTITIES,"Contract, Full Time",Professional,Sciences / Laboratory / R&D,"$2,500to$5,000",Monthly,"About Institute for Infocomm Research (I²R)  The Institute for Infocomm Research (I²R) is a member of the Agency for Science, Technology and Research (A*STAR) family and is Singapore’s largest ICT research institute. Our strategic thrusts are in the spheres of intelligence, communications and media and our research capabilities are in shared sensor networks, public-public/public-private data-sharing platform, big data analytics and visualisation solutions. For more information about I²R, please visit www.i2r.a-star.edu.sg We are looking for a data engineer who can contribute on text analytics-related projects. Job Responsibilities:  Deliver results: Develop technologies, improve performance Demonstrate long-term vision, while effectively supporting short-term goals     ","Requirements   Minimum Bachelor degree in computer science or other related areas Possess expertise in the areas of natural language processing, text mining, deep learning, machine learning, and/or cloud computing Being an excellent team player Good interpersonal and communication skills  The above eligibility criteria are not exhaustive. A*STAR may include additional selection criteria based on its prevailing recruitment policies. These policies may be amended from time to time without notice. We regret that only shortlisted candidates will be notified",https://www.mycareersfuture.sg/job/research-engineer-i2r-astar-research-entities-f158ee29cb4064031400ff676016a6ac,South,
146,Instructor in Interactive Media Design (Educator Track),NATIONAL UNIVERSITY OF SINGAPORE,Full Time,Professional,Education and Training,"$4,100to$6,150",Monthly,"Instructor in Interactive Media Design (Educator Track) The Department of Communications and New Media at National University of Singapore is looking to fill the following Educator Track (teaching only) positions. We seek applicants with expertise in data science, interactive media design and software studies. The applicant will have (industry related and/or teaching) experience in one or more of the following areas:  Data analytics, big data, data visualisation, and use of software tools such as R and Python, and web technologies. Computational media and communication, and artificial intelligence Game studies User interface, user experience and HCI design  Responsibilities: Successful candidates must have a Masters’ degree or a closely affiliated discipline by the appointment of start date and a record of excellence in teaching in large comprehensive universities. The candidate must also have approximately 2 years of teaching experience. A passion for working closely with students and a commitment to student learning are essential. Successful candidates are also expected to have experience with online teaching and the development of MOOCs. The successful candidate is expected to teach 5 modules per academic year. Other duties include supervision of honours students and graduate students, and administrative service. The anticipated start date is 1 July prior to the beginning of the semester in August 2019. For further enquiries, please email: cnmbox15@nus.edu.sg","RequirementsInterested parties must submit the following documents, in an email clearly indicating the position they are applying for, to Ms Jasmin Tay at cnmbox15@nus.edu.sg:  NUS Personal Particulars Form (http://www.fas.nus.edu.sg/cnm/images/Brochures/Personal-Particulars-Form.pdf) NUS Personal Data Consent Form for Job Applicants (http://www.nus.edu.sg/careers/files/NUS-Personal-Data-Consent-for-Job-Applicants.pdf) Academic History: certificates of degrees obtained, scholarships and awards. Employment History: Full CV, including education, professional background, teaching and supervision, research activities and achievements, honours and awards, and service accomplishments to date. List all academic and non-academic positions. Copies of Academic Degree Certificates obtained Teaching Portfolio: 	 A preface (maximum 300 words) that makes the case for your appointment. This should be highly distilled summary of your key contributions to student learning and educational leadership, guided by your teaching philosophy. A Teaching Statement that focuses on evidence of student learning and educational leadership (if applicable). Note that the Teaching Statement, together with documents on research (where applicable) and service contributions should be no more than a maximum of 3,000 words.   Documents on research, where applicable. Note that the documents on research (together with the Teaching Statement and documents on service contributions) should be no more than a maximum of 3,000 words. Teaching evaluations and peer review reports, if available. Other evidence of teaching excellence and/or other contributions to education e.g. curriculum development, pedagogical innovation, etc. should be provided. If applicable, a complete list of publications, grouped according to papers, books, and reviews, including page numbers, in bibliographic form. Documents on service contributions. List and elaborate on the impact of service to department/faculty/university, international academic community, and/or national and international agencies. Note that the documents on research (together with the Teaching Statement and documents on service contributions) should be no more than a maximum of 3,000 words. Teaching evaluations and peer review reports, if available. Other evidence of teaching excellence and/or other contributions to education e.g. curriculum development, pedagogical innovation, etc. should be provided. THREE letters of reference to be arranged by the applicant to be submitted directly by the referees at cnmbox15@nus.edu.sg.  For full consideration, please submit a complete application, including letters of recommendation, by 3 May 2019. Applications received after this date may be considered until the position is filled. Only shortlisted candidates will be contacted. Enquiries may be directed to cnmbox15@nus.edu.sg. Further information about working at the National University of Singapore is available at http://www.nus.edu.sg/careers/whyjoinus.htm.   Only shortlisted candidates will be notified. The review will continue until the job is filled.",https://www.mycareersfuture.sg/job/instructor-interactive-media-design-national-university-singapore-5cf85c3239164eb3d326c4f084f8a464,South,Government support available
147,Lecturer,SINGAPORE UNIVERSITY OF SOCIAL SCIENCES,"Contract, Full Time",Manager,Education and Training,"$5,000to$10,000",Monthly,"The School of Business (SBIZ) at Singapore University of Social Sciences aims to educate business minds and in the process, transform the lives of our students when they graduate with a business degree. SBIZ currently has more than 4,000 students enrolled in various degree programmes.   Our students are mainly working adults who are keen to upgrade and remain competitive in the fast-paced business world. We also have a sizable group of full-time students pursuing their degree education full time in the University. To equip our students for a better future, we provide them with a curriculum that is industry-relevant and we adopt innovative and practice-oriented pedagogical approaches (e.g. case study, flipped-classroom). Classes are interactive in nature and instructors go beyond lectures and facilitate interactive discussions and activities that require application of theories to solve real world problems. As most of our students are working, they are able to apply what they have learnt in the classroom to real-life scenarios in their workplace almost immediately. This enables them to live out our maxim - Learn Today, Apply Tomorrow.   SBIZ is now recruiting passionate full-time faculty members who are aligned with our education aspirations. The responsibilities of SBIZ full-time faculty members include teaching and developing courses, conducting academic and/or applied research, and managing degree programmes and projects. We are interested in candidates in the following areas:    Accountancy (especially in the areas of Financial Accounting, Managerial Accounting, Assurance, Taxation, Business Valuation and Accounting Theory)  Analytics (especially in the areas of Machine Learning, Data Mining, Text Mining, Statistics, Forecasting, Optimisation, Data Visualisation, Data Management, IoT and Big Data) Business Law Entrepreneurship  Finance Information Systems Project Management Quality Management Supply Chain Management (especially in the areas of Procurement and International Trade  System) Strategy Operations Management Customer Relationship Management Business excellence (especially in the area of SPRING Singapore's Business Excellence framework) ","Requirements Ph.D. degree holder in a relevant discipline. Ph.D candidates nearing completion will also be considered. Candidate with teaching and/or working experience in the relevant area will have an added advantage. In the area of Finance, candidates with a Chartered Financial Analyst (CFA) qualification or those in the area of Fintech, crytocurrency and digital banking will have an added advantage. In the area of Accountancy, candidates with a Chartered Accountant of Singapore qualification (or equivalent professional qualification) and at least a Master's degree in a relevant area will also be considered.  In the area of Business Law, candidates with a Bachelor's degree in Law and at least 5 years of relevant working experience will also be considered.    For more information and application, please visit our website: http://www.suss.edu.sg/careers/appointments-vacancies/Pages/Academic-Appointments-(Full-time).aspx (Only shortlisted candidates will be notified)",https://www.mycareersfuture.sg/job/lecturer-singapore-university-social-sciences-5f7429b478bfdc75fcaf517867d87c1f,West,Government support available
