,job_titles,companys,employment_type,seniority,industrys,salary,salary_terms,job_descriptions,job_requirements,links,location,gov_support
68,Junior - Mid Level Data Engineer,TRAVELOKA SERVICES PTE. LTD.,Permanent,Fresh/entry level,Information Technology,"$3,000to$6,000",Monthly,"Data Engineers at Traveloka are passionate on designing, building, and maintaining our growing big data platform. We collect millions of events everyday to our data lake for insights, and to our real time pipeline for enabling many data-driven features such as personalized user experience. What you do will be mixed of software engineering, system architecture design, and operation:   You will be designing, building, supporting and scaling our data infrastructure. Including monitoring, alerting and debugging infrastructure that is streaming millions of events per hour with thousands of pipelines running   Collaborate and coordinate with other departments (product, etc) to solve their use case using data technology; state of the art big data stack such as Kafka, Pubsub, Spark, DataFlow, BigQuery, Airflow, etc. on hundreds of terabytes data.   Explore/learn new technologies that can complement or replace our current stack to improve it.  ","Requirements  Passion in big data, software engineering, and systems.   Excellent analysis and reasoning of system behaviors   Fresh Graduate to 4 years hands-on experience   Uphold best practices and principle around clean code, testing, continuous integration   Strong team player and collaborator   Having high level of responsibility and resilience in dealing with issues   Preferably familiar with big data infrastructure (such as Kafka, Spark, etc.), cloud based infrastructure, varying databases, security concerns would be an advantage.   Familiar with Java/JVM. Python is added advantage   Experience working with data infrastructure will be valuable, but your desire to learn data infrastructure is more important.   Having systems operational experience is a bonus, but not required.  ",https://www.mycareersfuture.sg/job/junior-mid-level-data-engineer-traveloka-services-8870a85841fc70677fdef3807414055f,,Government support available
69,"Manager, Data and Analytics, Advisory",ERNST & YOUNG ADVISORY PTE. LTD.,"Permanent, Full Time",Manager,Information Technology,"$6,000to$12,000",Monthly,"EY Data and Analytics is the data and advanced analytics capability within EY Asia-Pacific.  We have vibrant practices in Australia, New Zealand, Singapore, Hong Kong, Korea, The Philippines and Malaysia. EY Data and Analytics creates intelligent client organizations using data & advanced analytics.  We go beyond strategy and provide end to end implementation of real life data environments and have some of the best architects, project managers, business analysts, data scientist, big data engineers, developers and consultants in the region.     Due to our continued growth we are looking for a talented, inquisitive and proactive Big Data IM join our team","RequirementsREQUIREMENTS:   Bachelor degree and above in Analytics, Information Systems Management, Computer Science or related fields. Hands on experience in implementing data integration processes, designing and developing data models(ER/Dimensional/Vault), designing, developing and building in detail ETL/ELT processes or programs. Contributed in at least 2 phases of SDLC lifecycle and experience in Big Data, data warehouse, data analytics projects, data migration, change management process, and/or any IM (Information Management) related works. Experience with Hadoop Technologies such as HDFS/MapRFS, Map Reduce(II), Advanced HDFS ACLS, Hive, HBase, Cassandra, Impala, Spark, Drill, Sentry, Sqoop, Flume, Kafka, Storm, Zookeeper and zkClient tool Good understanding on Cloudera or Horton Works or MapR Hadoop Distribution with deep understanding of administration concepts Experience in working with RDBMS technologies such as, Oracle, Microsoft SQL Server, PostgreSQL, DB2, MySQL etc. Experience in MPP database technologies such as Teradata Hands-on experience on Spark, SparkSQL, Hive QL, Drill QL, Impala, Spark Data Frames and Flink CEP, Flink TableAPI&SQL as ETL framework Hands-on programming skill on Scala/Python using Spark/Flink Framework Strong knowledge of Big Data stream ingestion and IoT streaming using Flume, or Kafka, Storm, MQTT, RabbitMQ Good understanding Spark Memory management with and without Yarn memory management Should have basic understanding on Cloudera Manager or HortonWorks Ambari and MapR Control System Should have experience developing and designing in one or more NoSQL database components and objects using Cassandra, Mongo, HBase, CouchDB/Couchbase, Elasticsearch Should have experience developing and designing in one or more NoSQL database technologies such as Cassandra, Mongo, HBase, CouchDB/Couchbase, Elasticsearch etc. Should good working knowledge of HCatalog and Hive Metadata. Should have working knowledge of Kerberos authentication tool Experience in commercial ETL tools like Talend, Informatica or Alteryx will be added advantage Greenplum, IBM Pure Data etc. will be an added advantage Experience in working with RDBMS technologies such as, Oracle, Microsoft SQL Server, PostgreSQL, DB2, MySQL etc. Experience in MPP database technologies such as Teradata, Greenplum, IBM Pure Data etc. will be an added advantage Good knowledge of data warehouse and data management implementation methodology. Good knowledge of the Information Management framework, including operating model, data governance, data management, data security, data quality and data architecture. Knowledge and experience in  data visualisation concepts using tools such as SAS Visual Analytics or WRS, Tableau, Microsoft PowerBI or Reporting Services, IBM Cognos, SAP Business Objects, etc. will be an advantage. Ability to pick up new tools and able to be independent with minimal guidance from the project leads/managers. Strong analytical and creative problem solving capabilities. Ability to establish personal credibility quickly and demonstrate expertise. Ability to create a positive learning culture, coach and develop team members.      ADDITIONAL REQUIREMENTS:     4 to 10 years of experience in data warehouse, data analytics projects, change management process, and/or any IM (Information Management) related works. Delivered at least two (2) full SDLC lifecycle projects. At least one of the industry or domain experiences in Banking/ Telecommunications/ Consulting Preferably with experience in implementation best practices involving data management, data reconciliation, data duping, scheduling, etc. Able to assess design considerations in the aspect of data management and integration Experience with Agile/SCRUM/Kanban software implementation methodology Should have good knowledge in DevOps engineering using Continuous Integration/Delivery tools such as Docker, Jenkins, Puppet, Chef, GitHub Atlassian Jira etc. Certification in any of Hadoop Big Data tool/technology, data integration, data management, or visualisation tools is an added advantage. Knowledge about the infrastructure paradigms such as OS, network etc. is an added advantage. ",https://www.mycareersfuture.sg/job/manager-data-analytics-advisory-ernst-young-advisory-727ec63e9e5c2537d3daf49f8384af07,Central,Government support available
70,Data Scientist,NTUC ENTERPRISE NEXUS CO-OPERATIVE LIMITED,Full Time,"Professional, Executive, Senior Executive","Information Technology, Others","$4,000to$7,000",Monthly,"The rapid adoption of technology and mobile devices have contributed to vast new flows of information which are larger in volume, faster in velocity, diverse in variety, and requires veracity of the information for use. This new type of information composed of structured and unstructured data, broadly known as big data (and combined with tools and platforms), if utilized well, could radically improve business performance. As the organization embarks to become a data-driven organization, significant decisions and value generation will be based on the data that we capture and deploy. The 7 SE’s range in a broad scope of data from FairPrice (retail), Income (insurance), Unity (healthcare), FoodFare (F&B), LearningHub (training), First Campus(ECE), Link (membership). The leaders of these groups are keen to utilize the data to drive growth, deliver customer service, and create personalized experiences. In this role you will work with various industries and most diverse datasets in Singapore. We are seeking a strong candidate with advanced analytics experience to fill a data scientist position within NTUC Advanced Analytics Centre.  The role will be responsible for executing analysis and data science modelling that delivers valuable insights, providing predictive analytics solution with high quality and make sure the deployment with sound business sense. You will be proficient in the application of customer transaction data, click-streaming data and unstructured data & analytics techniques to domain specific problems such as customer segmentation and targeting, cross- sell/up-sell propensity model, acquisition model, retention model and marketing campaign testing, recommendation and personalization etc. Responsibilities: ·       Work with various teams to plan, identify, collect and integrate data from multiple systems ·       Building and automate of the data workflows such as extraction, transformation and load (ETL) to transform raw data for analytic purpose ·       Define analytical strategy to address identified opportunities, including analytical approaches, data and technology requirements. ·       Develop models and perform statistical analysis to solve various strategic business problems,  e.g. customer segmentation and targeting, propensity model, acquisition model, retention model and perform marketing campaign testing. ·       Communicate and present key analytical findings to senior management and/or other stakeholders with actionable recommendations.  ·       Deploy analytical/optimization solutions to drive growth ·       Work with other data scientists in the team to drive projects","RequirementsRequirements: ·       Master in Statistics, Computer Science, Operations Research. ·       Familiarity with consumer marketing and ideally have industry experience (e.g. Retail, consumer banking, ecommerce, insurance etc)  ·       Deep understanding of statistical analysis, data mining and machine learning  ·       Experience in working with large structured and unstructured data sets ·       Team player to build strong business partnerships ·       Have competency in one or more of the following programming languages or tools:  Python, R, Spark, Hive, Impala Pig or Scala ·       Ability to write production code will be an advantage    ",https://www.mycareersfuture.sg/job/data-scientist-ntuc-enterprise-nexus-co-operative-892da7cd8e95ca26dd6d96a07bea58c9,,Government support available
71,DATA ENGINEER,ZENIKA PTE. LTD.,Full Time,Professional,Information Technology,"$5,000to$7,000",Monthly,"As a Data Engineer, you will work with our customers' Big Data teams to design and develop new data architectures. You will participate in setting up and enriching datalakes based on the Hadoop ecosystem. You will implement complex data acquisition and analysis workflows to bring out untapped business opportunities. You will work with Data Scientists in a spirit of sharing skills. You have a first significant experience on a Big Data project. You want to challenge yourself on a large volume of distributed and real-time infrastructures. You like to share your skills and take your technical choices. At Zenika you will be able to: - Evolve within a passionate team always on the lookout for a new technology to crunch the data - Taste of developing POCs on the most popular Frameworks - Have dedicated time to contribute to Open-Source projects - Animate hands-on for internal and external events - Attend the best conferences (Devoxx, Hadoop Summit Europe, Berlin Buzzwords, ...) - Become a certified trainer for our partners (Confluent, DataStax, Couchbase, Lightbend, ...)  ","Requirements- Java is your mother tongue. Object-Oriented Programming is an art of which you master the secret techniques (design patterns). - You are familiar with Frameworks of tests such as JUnit, Mockito, Gatling. - JSON and REST APIs are your daily routine. - The message brokers (Apache Kafka) are not unknown to you. - You prefer to use your ""relational"" skills to team building rather than to design the storage of your data. - Stream processing is the philosophy you adopted for your data projects (Spark, Flink, Kafka Streams, ...) - You do not imagine working on an environment other than Linux (Ubuntu, CentOS) - You are sensitive to craftsmanship approaches (CleanCode, TDD).",https://www.mycareersfuture.sg/job/data-engineer-zenika-15edec0b30fd66464eafeabe29b3eac1,Central,
72,Data Integration Architect,MEGAMIND CONSULTING PTE. LTD.,Full Time,Professional,Information Technology,"$6,500to$9,000",Monthly,"As a Data Architect, you will work with our business teams to enable the design and build of repeatable analytics solutions, and to help drive innovation through proof of concepts and underlying capabilities. Accountabilities We seek an individual who will embody a collaborative approach in bringing both business and technology stakeholders together to deliver technology solutions that enable tangible business benefits.   What you will do...   ·       Own the definition of data architecture components for information management solutions to facilitate storage, integration, usage, access, and delivery of data assets across the enterprise. ·       Produce and approve architecture diagrams for enterprise data and analytics solutions including conceptual, logical and physical. ·       Architecting conceptual, logical and physical data models using data modelling approaches (e.g. 3NF relational, Kimball dimensional) in standard modelling tools. ·       Designing the data integration architecture based on solution requirements e.g. real-time, near real-time, batch. ·       Support, Define and manage work packages that deliver elements of an information management solution e.g. data warehouse, data mart, ETL service, operational data store. ·       Solve the challenge of integrating disparate sources of enterprise data and information to model and visualize their businesses and derive insight. ·       Develop and maintain long lasting relationships with senior stakeholders, both during and outside of project delivery. ·       Supporting a data design work-stream in an agile delivery or on a large-scale ‘waterfall’ delivery project for an enterprise data warehouse or reporting solution. ·       Lead the design of the architecture for an on-premises or cloud-based, data warehouse, or big data solution; this could cover several technologies, countries and lines of business. ·       Lead and Assist in the further development of our capability through proof-of-concepts.","Requirementskills You are familiar with... Data Integration & Federation: ·       e.g. SAP, IBM, Oracle, Microsoft, Informatica, Ab Initio, and data integration tools for Hadoop-based architectures. Data Repositories: ·       e.g. Oracle, Teradata, SQL Server, Netezza, DB2, Greenplum, Amazon Redshift, Cassandra, Hadoop.   EA License No. 14C7181 Reg No. R1222538      ",https://www.mycareersfuture.sg/job/data-integration-architect-megamind-consulting-a333006714333386a028e7d79aba859b,Central,Government support available
73,Data Scientist,DENTSU AEGIS NETWORK HUB2050,Full Time,Executive,"Engineering, Information Technology, Sciences / Laboratory / R&D","$5,000to$10,000",Monthly,"This is an exciting time to join Dentsu Aegis Network (DAN) as we focus on becoming a 100% digital economy business by 2020 through content, media and commerce. We are well placed to build capability, scale and sustainable growth as a high performance business. Our strategy is driven by our unique culture with one vision (to innovate the way brands are built), one set of values and a unique operating model which drives collaboration, client focus and attention.  Dentsu Aegis Network believes that everybody should be treated equitably. We are committed to creating an inclusive, diverse and collaborative environment that enables our people to do what they do best – innovating the way brands are built. This is regardless of age, race, disability, sexual orientation, gender, marital, civil partnership or parental status, religion or belief. As a global organisation, we offer fair employment and advancement opportunities for our employees to succeed and advance within their profession, both in Singapore and around the world.   BACKGROUND: About Dentsu Aegis Network Dentsu Aegis Network helps clients build consumer relationships by communicating their products and brands effectively. Our distinctive and innovative range of products and services include marketing and communications strategies through digital marketing and creative execution, media planning and buying, creative services, technology applications, SEO, content creation, brand tracking and marketing analytics. Find out more about us at https://www.dentsuaegisnetwork.com/   About Dentsu Aegis Network’s Global Data Innovation Centre As the world of data continues to grow exponentially in the advent of connected devices, IoT, industrialised digitization of the economy and the way people move through digitized networks, Dentsu Aegis seeks to harness the power of data and transform this into intelligent applications, products and platforms. The Dentsu Aegis Network Global Data Innovation Centre, hubbed in Singapore, is a strategic initiative to ensure that the Group harnesses this power effectively and at scale. This set up builds from the data innovation practice that was launched in 2012 and is now designed to deliver on global initiatives from Singapore.   KEY ACCOUNTABILITIES: As a Data Scientist, you will be a key member of the Centre. You will play a leading role in developing analytics solutions and data capabilities that will enable us to be thought leaders in the practice of data and analytics. You will work in a team of 4 – 5 talented Data Scientists and behavioural analysts. On a day-to-day basis, your responsibilities can comprise of:  Being an effective bridge between the Centre, IT and our Global Big Data Infrastructure platform to ensure that the data work streams are effectively collected, organized and processed Make data actionable by designing and building effective application programming interfaces -- APIs -- and services that allow the data to flow into any system that can make use of the information in real-time. Technical expertise for design, development, implementation of information storage and retrieval, data flow and analysis and provide effective recommendations based on trades among data volumes, number of users, logical and physical distribution, response times, retention rules, security and domain controls. Develops relational and/or Object-Oriented databases, database parser software and database leading software.   Maintains and updates for new development a set of records for, but not limited to, creating or recreating ad hoc queries, scripts, codes, and macros.   ","RequirementsPERSON SPECIFICATION: We invite people passionate about data, intelligence and application of same in the market place to join a growing team. You have to be a self-starter, motivated and yet collaborative. You can think on your feet, connect disparate dots, imagine connections and importantly, craft approaches to turn ideas and imagination into real capabilities, inspired by data. You are excited by your work going live in the market with clients and teams around the world.  PhD/Masters in Computer Science or Computer Engineering, with specialisation in deep learning or similar Proven working experience in machine and deep learning projects, especially in using deep learning ​Experience handling imbalanced data classes Able to generate relevant outputs that are not always seen in training data ​ Embedded knowledge  Experience handling large search spaces effectively and efficiently  Familiar with Python, Tensorflow, Keras Experience in dealing with large unstructured data sets Good understanding of big data architectures and solutions Good leadership skills Capable in leading a young team of data science analysts Proactive, customer-oriented and results-oriented Excellent track record in being part of a team that has deployed industrial-scaled, cutting-edge and commercial initiatives ",https://www.mycareersfuture.sg/job/data-scientist-dentsu-aegis-network-hub2050-558ef521adf106695584d1c1592cdeff,Central,Government support available
74,Full Stack Developer,DATHENA SCIENCE PTE. LTD.,Full Time,"Fresh/entry level, Non-executive",Engineering,"$4,000to$6,000",Monthly,"Job title: Full Stack Developer                Reports to: Solution Architect                  About Dathena Science   Dathena is a Swiss and Singaporean company developing data governance software based on artificial intelligence algorithms. Dathena is the most complete and accurate data governance and classification platform and is the only solution to easily classify and manage data with this level of accuracy while helping companies to comply with regulations. Using cutting edge machine learning technology, Dathena sift through all unstructured data allowing to regain full control on company’s information.   We are looking for a Full Stack Developer for a permanent position or an internship to work with us and our partners to improve our leading technology in managing the confidentiality of information of our Fortune 500 clients.   Job Purpose:  Full Stack Developer, keen to develop web/cloud-oriented and big data technologies, and integrate new libraries / framework into our codebase. Bring the knowledge and curiosity in Dathena to develop big data applications. Live your passion for software development in exciting Data Science and Cybersecurity projects and be inspired by your colleagues' enthusiasm. ","RequirementsResponsibilities:   You will implement sophisticated product development projects for the enterprise and cloud environments using modern, agile project methods within the Dathena Development & Engineering team. You will efficiently and competently solve tricky software challenges, because continuous further development and active knowledge exchange mean that you will be working with the latest methods and tools and always be on trend. As a Full Stack Developer, you will cooperate with interdisciplinary teams in projects and experience how technology and team spirit unite to create innovative solutions and work closely with our team of data scientists, researchers and developers to implement the state of the art.  Skills and Qualifications:  Python 3+ JavaScript: React & Node.JS Message queues (RabbitMQ / ZeroMQ) Database design & usage (MySQL / PostgreSQL) Used to develop and deploy on Ubuntu and/or OSX Celery is a plus Django / MVC is a plus Docker is a plus  Soft Skills:  Fluent in English Data-oriented personality Time management Interpersonal Skills Critical Thinking Proactive and interested in A.I., Big Data and cyber-security, the candidate should be able to implement good security practices. New tools are available every day, some of them could improve our overall environment. The Full Stack Developer has to be lazy in a smart way: everything should be automated with as little human interaction as possible  Working Conditions:  The Full Stack Developer must fully embrace the team spirit of a young and innovative Start-up. They must be able to adapt to a multi-cultural environment. Travel and remote location might be required.     Location: Singapore    ",https://www.mycareersfuture.sg/job/full-stack-developer-dathena-science-5fb5754485af66782640da6ad970b4a6,Central,Government support available
