,job_titles,companys,employment_type,seniority,industrys,salary,salary_terms,job_descriptions,job_requirements,links,location,gov_support
24,Data Scientist,HEWLETT PACKARD ENTERPRISE SINGAPORE PTE. LTD.,Permanent,Professional,Consulting ,"$4,800to$9,000",Monthly,"Hewlett Packard Enterprise is an industry leading technology company that enables customers to go further, faster. With the industry’s most comprehensive portfolio, spanning the cloud to the data center to workplace applications, our technology and services help customers around the world make IT more efficient, more productive and more secure.   HPE APJ Innovation Center Singapore focuses on providing customers with world class products and solutions in the big data analytics space, using state-of-the-art big data technologies and advanced analytics techniques.   We have an exciting opportunity for a Data Scientist to join our team and make a difference!  He/she will be a part of our innovation center and involved in interesting work such as NLP, IoT analysis and generally exposed to different domains.   ","RequirementsResponsibilities  Collaborate with business partners from various industries to identify gap and practical problems. Develop machine learning and quantitative models to solve business problems. Create actionable insights and meaningful visualizations using machine learning technologies that “tell a story"" to the customers. Communicate findings to sales, engineering and business teams.    Knowledge and Skills Desired:  Deep understanding of multiple machine learning and artificial intelligence Knowledge and understanding of data pipeline Deep knowledge of at least one of the frameworks Deep mathematical understanding of statistics, calculus and other related fields         Education and Experience Required:  PhD degree in Mathematics, Statistics, Operations Research, Computer Science or equivalent In the absence of a PhD, a Master´s Degree in one of these areas and 3 years and above of industry experience applying analytics and data science is required 3 years’ experience in programming in Python or R 3 years’ and above of industry experience applying analytics and data science 3 years’ programming experience in two or more relevant languages Broad, general knowledge of Machine Learning and Artificial Intelligence Framework ecosystems and languages, such as:  - Caffe - TensorFlow  ",https://www.mycareersfuture.sg/job/data-scientist-hewlett-packard-enterprise-singapore-da2b2cdecb496ddf6f871089b2568c9c,South,Government support available
25,Data Scientist,HEWLETT PACKARD ENTERPRISE SINGAPORE PTE. LTD.,Permanent,Professional,Consulting ,"$5,200to$10,000",Monthly,"Hewlett Packard Enterprise is an industry leading technology company that enables customers to go further, faster. With the industry’s most comprehensive portfolio, spanning the cloud to the data center to workplace applications, our technology and services help customers around the world make IT more efficient, more productive and more secure.   HPE APJ Innovation Center Singapore focuses on providing customers with world class products and solutions in the big data analytics space, using state-of-the-art big data technologies and advanced analytics techniques.   We have an exciting opportunity for a Data Scientist to join our team and make a difference!  He/she will be a part of our innovation center and involved in interesting work such as NLP, IoT analysis and generally exposed to different domains. ","RequirementsResponsibilities  Collaborate with business partners from various industries to identify gap and practical problems. Develop machine learning and quantitative models to solve business problems. Create actionable insights and meaningful visualizations using machine learning technologies that “tell a story"" to the customers. Communicate findings to sales, engineering and business teams.    Knowledge and Skills Desired:  Deep understanding of multiple machine learning and artificial intelligence Knowledge and understanding of data pipeline Deep knowledge of at least one of the frameworks Deep mathematical understanding of statistics, calculus and other related fields         Education and Experience Required:  PhD degree in Mathematics, Statistics, Operations Research, Computer Science or equivalent In the absence of a PhD, a Master´s Degree in one of these areas and 3 years and above of industry experience applying analytics and data science is required 3 years’ experience in programming in Python or R 3 years’ and above of industry experience applying analytics and data science 3 years’ programming experience in two or more relevant languages Broad, general knowledge of Machine Learning and Artificial Intelligence Framework ecosystems and languages, such as:  - Caffe - TensorFlow",https://www.mycareersfuture.sg/job/data-scientist-hewlett-packard-enterprise-singapore-86e18b1b2b60e17a2327afd40d677a25,South,Government support available
26,Senior Level Data Scientist,TRAVELOKA SERVICES PTE. LTD.,Permanent,Executive,Information Technology,"$8,300to$15,000",Monthly,"Job Description As a Data scientist, you will be applying machine learning techniques such as deep learning, reinforced learning, decision tree learning and other techniques to solve complex problems and drive insights from our sea of data. You will be responsible for:   Analyzing large, complex datasets into actionable insights   Use data to solve complex problems which are pivotal to our business   Effectively conceptualize analysis to internal stakeholders   Conduct advanced statistical analysis   Develop practical algorithms and frameworks to optimize Traveloka’s capabilities   Working in Traveloka:   You will work in cross-functional teams and meet great people regularly from top tier technology, consulting, product, or academic background.   We work in open environment where there are no boundaries or power distance.   Everyone is encouraged to speak their mind, propose ideas, influence others, and continuously grow themselves.   Get the exposure to multi-aspect, collaborative, intensive startup experience with our recent expansion into Southeast Asia and exploration of new products.  ","Requirements  Solid programming skills and understanding of statistical models   Bachelors/Masters/PhD degree from top universities in a quantitative field (Physics, Mathematics, Computer Science, Engineering, etc.)   8+ years of relevant experience in Advance Analytics   Experienced in tools such as: R, python, MATLAB and etc   Experienced in machine learning libraries such as: Tensorflow, Theano, Keras, Scikit-learn, SciPy and etc.   Solid analytical and problem solving skills to create data-driven insights   Passion in big data  ",https://www.mycareersfuture.sg/job/senior-level-data-scientist-traveloka-services-8adb5c22263d490fd19ff2b6362b9be4,,Government support available
27,Mid - Senior Level Data Scientist,TRAVELOKA SERVICES PTE. LTD.,Permanent,Executive,Information Technology,"$6,100to$10,700",Monthly,"As a Data scientist, you will be applying machine learning techniques such as deep learning, reinforced learning, decision tree learning and other techniques to solve complex problems and drive insights from our sea of data. You will be responsible for:   Analyzing large, complex datasets into actionable insights   Use data to solve complex problems which are pivotal to our business   Effectively conceptualize analysis to internal stakeholders   Conduct advanced statistical analysis   Develop practical algorithms and frameworks to optimize Traveloka’s capabilities   Working in Traveloka:   You will work in cross-functional teams and meet great people regularly from top tier technology, consulting, product, or academic background.   We work in open environment where there are no boundaries or power distance.   Everyone is encouraged to speak their mind, propose ideas, influence others, and continuously grow themselves.   Get the exposure to multi-aspect, collaborative, intensive startup experience with our recent expansion into Southeast Asia and exploration of new products.  ","Requirements  Solid programming skills and understanding of statistical models   Bachelors/Masters/PhD degree from top universities in a quantitative field (Physics, Mathematics, Computer Science, Engineering, etc.)   6+ years of relevant experience in Advance Analytics   Experienced in tools such as: R, python, MATLAB and etc   Experienced in machine learning libraries such as: Tensorflow, Theano, Keras, Scikit-learn, SciPy and etc.   Solid analytical and problem solving skills to create data-driven insights   Passion in big data  ",https://www.mycareersfuture.sg/job/mid-senior-level-data-scientist-traveloka-services-cee58da0b16561b6d739767873dc8bd1,,Government support available
28,Mid Level Data Scientist,TRAVELOKA SERVICES PTE. LTD.,Permanent,Executive,Information Technology,"$4,300to$7,600",Monthly,"As a Data scientist, you will be applying machine learning techniques such as deep learning, reinforced learning, decision tree learning and other techniques to solve complex problems and drive insights from our sea of data. You will be responsible for:   Analyzing large, complex datasets into actionable insights   Use data to solve complex problems which are pivotal to our business   Effectively conceptualize analysis to internal stakeholders   Conduct advanced statistical analysis   Develop practical algorithms and frameworks to optimize Traveloka’s capabilities   Working in Traveloka:   You will work in cross-functional teams and meet great people regularly from top tier technology, consulting, product, or academic background.   We work in open environment where there are no boundaries or power distance.   Everyone is encouraged to speak their mind, propose ideas, influence others, and continuously grow themselves.   Get the exposure to multi-aspect, collaborative, intensive startup experience with our recent expansion into Southeast Asia and exploration of new products.  ","Requirements  Solid programming skills and understanding of statistical models   Bachelors/Masters/PhD degree from top universities in a quantitative field (Physics, Mathematics, Computer Science, Engineering, etc.)   3+ years of relevant experience in Advance Analytics   Experienced in tools such as: R, python, MATLAB and etc   Experienced in machine learning libraries such as: Tensorflow, Theano, Keras, Scikit-learn, SciPy and etc.   Solid analytical and problem solving skills to create data-driven insights   Passion in big data  ",https://www.mycareersfuture.sg/job/mid-level-data-scientist-traveloka-services-8dba1deab655a0a840105310f2308dc2,,Government support available
29,Junior - Mid Level Data Scientist,TRAVELOKA SERVICES PTE. LTD.,Permanent,Fresh/entry level,Information Technology,"$3,000to$6,000",Monthly,"As a Data scientist, you will be applying machine learning techniques such as deep learning, reinforced learning, decision tree learning and other techniques to solve complex problems and drive insights from our sea of data. You will be responsible for:   Analyzing large, complex datasets into actionable insights   Use data to solve complex problems which are pivotal to our business   Effectively conceptualize analysis to internal stakeholders   Conduct advanced statistical analysis   Develop practical algorithms and frameworks to optimize Traveloka’s capabilities     Working in Traveloka:   You will work in cross-functional teams and meet great people regularly from top tier technology, consulting, product, or academic background.   We work in open environment where there are no boundaries or power distance.   Everyone is encouraged to speak their mind, propose ideas, influence others, and continuously grow themselves.   Get the exposure to multi-aspect, collaborative, intensive startup experience with our recent expansion into Southeast Asia and exploration of new products.  ","Requirements  Solid programming skills and understanding of statistical models   Bachelors/Masters/PhD degree from top universities in a quantitative field (Physics, Mathematics, Computer Science, Engineering, etc.)   Fresh graduates with internship experience - 3+ years of relevant experience   Experienced in tools such as: R, python, MATLAB and etc   Experienced in machine learning libraries such as: Tensorflow, Theano, Keras, Scikit-learn, SciPy and etc.   Solid analytical and problem solving skills to create data-driven insights   Passion in big data    ",https://www.mycareersfuture.sg/job/junior-mid-level-data-scientist-traveloka-services-1cd7eaa9c04792e882aad755fce1d921,,Government support available
30,Data Scientist,UNTANGLE AI PTE. LTD.,Full Time,Fresh/entry level,Information Technology,"$5,000to$7,000",Monthly,"We are looking to hire the best Data Scientists in the world. If you have a passion for technology, AI and deep learning,  this is an opportunity to work with great people in a great company. Learn from the top computer scientists in Asia and get hands on experience developing directly with clients. Be part of a game changing team and help developer the future of AI. Responsibilities:   The Data Scientist position is to carry out cutting edge research and development in building and deploying models both internally and to our clients specifications. This involves solving incredibly hard problems in AI and transforming those solutions in to world class products. This role covers a wide range of challenges, from enhancing our core deep learning methods to R&D in AI, to working directly with our customers to solve unique problems in their environments. Your primary responsibilities are:  Plan, develop and deploy models for our clients environments Train models and design inference systems across all data types Learn from senior engineers and implement solutions rapidly Work closely with other engineers to transfer research prototypes to production systems Propose new methods of discovery, optimisation or architectures Reproduce lead research papers ","Requirements   BSc or Master in Computer Science with experience in Deep learning, Computer Vision and Machine Learning Track record of solving industry problems through novel algorithms and innovation Strong understanding of model architectures of Deep Neural Networks (Gradients, Activation Paths, Activation Functions, etc.) Strong understanding of building blocks of statistics & probability (Covariance, Canonical Correlation, Markov Chains, Brownian Motion, Autocorrelation, Partial Autocorrelation, Bayesian optimisation, Hypothesis testing etc.) Strong understanding of statistical learning techniques (Classification, Regression, Clustering, metrics, structured learning, probabilistic graphical models) Self-reliant; able to work independently and accept responsibility for projects. Fast prototyping skills, including comprehensive feature integration during all cycles of development. Strong understanding of Databases and SQL Strong understanding of parallel processing using OpenMP Good business knowledge of Supply Chain(Domain)  Willingness to learn and experiment, with a passion for technology. Fluent in both written and spoken English. Experience with C++, Python, Caffe, Torch and Tensorflow    Nice to Haves:  Experience with adversarial models within Deep Learning (especially Generative Adversarial Networks) Understanding of systems analysis (Phase portraits, impulse response, filters, etc.) Publications in top computer vision/deep learning conferences and journals Contribution to major deep/machine learning open source libraries. ",https://www.mycareersfuture.sg/job/data-scientist-untangle-ai-4371030ab9ca99050516ae26ac3f7fd2,Central,Government support available
31,Data Scientist,AMPOTECH PTE. LTD.,Full Time,Professional,Information Technology,"$5,000to$8,000",Monthly,"Description of Role As a Data Scientist at Ampotech you will work with power consumption data generated from multiple buildings across several countries and develop equipment state and anomaly detection algorithms. In this role, you will work with the CTO and supporting staff such as software developers and data engineers to bring these algorithms into the production environment.","RequirementsDesired Qualifications   Master’s or PhD in Computer Science, Applied Math, or a similar field   Experience working with time-series data   Experience with Python   At least 2 years of experience in industry or an applied research environment  ",https://www.mycareersfuture.sg/job/data-scientist-ampotech-27837b2ff200338455306b4524262c50,Central,Government support available
32,"Data Scientist, AI Services",DATAROBOT SINGAPORE PTE. LTD.,Permanent,Professional,Information Technology,"$90,000to$150,000",Annually,"AI Services is a consulting division of DataRobot. As Data Scientist at DataRobot AI Services, you will work on various real-world problems across a variety of industries. You will be developing predictive models that add value to customer organizations and integrating those models into client environments.  Ideal candidates enjoy day-to-day data science problem-solving mixed with high levels of customer interaction.","RequirementsMain Requirements * 3+ years of real-world business experience with data science projects * Hands-on experience building and implementing predictive models * Experience with machine learning techniques * Strong understanding of applied statistics and data mining/munging techniques * Excellent organizational, communication, writing and interpersonal skills * Fluency with one of the scripting languages (Python / R)",https://www.mycareersfuture.sg/job/data-scientist-ai-services-datarobot-singapore-c642352bf70c0b2cb211b0306236486c,Central,Government support available
33,Field Data Scientist,DATHENA SCIENCE PTE. LTD.,"Full Time, Internship",Executive,Engineering,"$2,000to$5,000",Monthly,"About Dathena Science Dathena is a Swiss and Singaporean company developing data governance software based on machine learning algorithms. Job purpose                     This position will be part of the Client Solutions Team, and responsible for providing clients with the guidance and support needed throughout the full lifecycle of our solution’s implementation to ensure the successful and most effective use of Dathena’s products. In addition, this person will be a leader in ensuring overall client and partner satisfaction with Dathena’s products and related services. As a Field Data Scientist, you will act as a trusted technical advisor to support our clients to ensure they remain successful and realize the full value of their investment in our product. Responsibilities   Become a trusted expert in Dathena, our client platforms & partner vendor functionality to provide effective operational guidance around these technologies. Oversee client service requests acting as a service delivery and escalation manager. Help partners in their day-to-day challenges as our customers’ go-to resource for troubleshooting technical issues, and delivering innovative and scalable solutions to meet their business needs Build client success and prioritization plans aligned to key performance indicators and objectives. Ensure key accounts are updated on new product features and produce roadmaps to implement. Educate clients on the value of the overall solution and encourage optimal utilization. Channel customers’ technical platform feedback to the Dathena product team. Assist in prioritizing product requirements and platform improvements by understanding and communicating customer needs. Identify pattern and constantly look for opportunity to industrialize the Assessment to subscription process Develop best practice recommendations for Dathena clients based on product and vertical experience gained in the field. ","RequirementsDesired Experiences:  2+ years of experience in a customer/client-facing role such as Customer Success Manager, Technical Account Manager or Sales Engineer Comfortable managing technical conversations with technical and non-technical stakeholders. Problem-solving skills around technical, product, and business questions. Ability to build great relationships with technical and non-technical customers Contribute to the success of a dynamic and growing organization Good understanding of machine learning techniques and algorithms, such as K-means, k-NN, Naive Bayes, SVM, Decision Forests, etc. Knowledge with common data science toolkits, such as R, Spark, NumPy, etc. Excellence in at least one of these is highly desirable Good knowledge in using query languages such as SQL, Hive, Pig, etc. Knowledge with NoSQL databases, such as Cassandra and HBase Good applied statistics skills, such as distributions, statistical testing, regression, etc. Good scripting and programming skills: Python, Scala, Java.  Soft Skills:  Fluent in English Data-oriented personality Exceptional Oral and Written Communication Skills Time management Interpersonal Skills Critical Thinking Presentation Skills  Working Conditions: The Field Data Scientist must fully embrace the team spirit of a young and innovative Start-up. Travel and working from remote locations may be required. Location: Singapore R&D Office.                                                                                                                                                                                                               ",https://www.mycareersfuture.sg/job/field-data-scientist-dathena-science-ef8743c8aad21b7da211bfaf16e59a1e,,Government support available
34,Data Scientist,FACEBOOK SINGAPORE PTE. LTD.,Full Time,Professional,Advertising / Media ,"$9,000to$14,000",Monthly,"Facebook is seeking a Data Scientist to lead our Ads from China product team. We’re looking for someone who is passionate about digital advertising, product development, and hyper growth. The job is to be the ""data eyes and ears"" guiding the product team. Ads from China's mission is: to connect every business in China with people around the rest of world. This position is full-time and based in our Singapore office.","RequirementsResponsibilities  Defining new opportunities for product impact Influencing product and sales to solve the most impactful market problems.  Apply your expertise in quantitative analysis and the presentation of data to see beyond the numbers and understand how our users interact with our growth products.  Work as a key member of the product team to solve problems and identify trends and opportunities.  Inform, influence, support, and execute our product decisions and product launches.  Set KPIs and goals, design and evaluate experiments, monitor key product metrics, understand root causes of changes in metrics.  Exploratory analysis to discover new opportunities: understanding ecosystems, user behaviors, and long-term trends  Identifying levers to help move key metrics.  Minimum Qualifications  6+ years experience doing quantitative analysis, preferably for a web or mobile company  Fluency in SQL  Core statistical knowledge  Proven experience leading data-driven projects from definition to execution: defining metrics, experiment design, communicating actionable insights.  Able to mentor and guide junior data scientists  Experience leading analytics teams - advantage  Python, R or any other scripting language – advantage ",https://www.mycareersfuture.sg/job/data-scientist-facebook-singapore-33811af8b3bdae37fefc5122e4b58559,East,
