,job_titles,companys,employment_type,seniority,industrys,salary,salary_terms,job_descriptions,job_requirements,links,location,gov_support
208,Infrastructure Engineer - Junior DevOps,PALO IT SINGAPORE PTE. LTD.,"Permanent, Full Time",Junior Executive,Information Technology,"$4,000to$8,000",Monthly,"Palo IT is an innovation & agile development company. From Design Research to DevOps, we are in the business of end-to-end development of breakthrough digital experiences. As a community of innovators and developers, we also aim at renewing the way organizations operate, promoting sustainable business agility, user-centricity and open collaboration while having fun doing it.  Started in Paris in 2009 and with offices in Singapore, Hong Kong and Mexico, we are looking for our next superstar to join our exciting team in Singapore.  At Palo IT, our employees are not widgets. They are in the center of all our projects and successes. We offer an exciting and creative working environment, with endless opportunities to develop your skills, travel and take your career to the next level. Get in touch to find out more!  Your profile & role on the project  YOU:   Thrive on challenge. When was the last time you fail?   Are curious & always learning. What are you up to right now?   Can deal with constant change. When were you last surprised?   Have mastered at least one skill of your trade but you’re not defined by it. What can you  teach us? Can you wear many hats?  YOU AGAIN:  The Junior Engineer will learn to install, maintain, and support an on-premises cloud infrastructure and while learning and applying devops practices and solutions. That person will also learn about latest cloud-related technologies such as AWS, Puppet, Chef, Elk. Other infrastructure related activities such as maintaining the company internal server infrastructure and respond to consultant requests when required will be expected.  ➔ Install, maintain, and support on-premises and off-premises cloud stack.  ➔ Configure, maintain, and support the cloud-related infrastructures.  ➔ Act as a system administrator on different OSes (e.g. RHEL, Opensolaris, Ubuntu, etc.) and help teams deploy their application and automate their development and releases on  the cloud.  ➔ Ability to develop solutions and self-learn new tools and technologies.  ➔ Document, and share knowledge on developed DevOps solutions.  STILL YOU:  ✔ Strong interest in Cloud-based technologies and Devops practices  ✔ 0-2 year (s) of experience in configuration and maintenance of existing Cloud solutions  would be considered a plus  ✔ Experience in migration from Solaris to RHEL (Red Hat Linux) would be considered a plus  ✔ Bachelor’s degree in Computer Science or related area is required  ✔ Certification in AWS/Azure would be considered a plus  ✔ Excellent interpersonal, oral/written communication and cross-group collaboration skills  ✔ Independent thinker with strong work ethic but also willing and able to conform to  established architectural constraints  ✔ Detail oriented with good organizational skills  ✔ Good knowledge of Linux OS, Shell Scripting and SQL  ✔ Good understanding of networking would be a plus  ✔ Ability to work on multiple priorities and/or projects simultaneously  ✔ Problem-solving abilities and ability to meet reasonable deadlines  ✔ Strong team player, ability to build positive and collaborative relationships  ✔ Ability to work under general supervision  Your role at PALO IT  You will be invited to take part in R&D works done within our Practices. You will have the chance to assist or be a speaker at must-attend international IT conferences. You will have the opportunity to write articles for our Blog or specialized press. Genuine ambassador of PALO IT, you will present our offers and take an active role in the development of the company.  Your technical environment  # Cloud-based technologies (AWS/Puppet/Chef/Elk/Azure/Opencloud) # Devops practices # Linux OS, Shell Scripting, SQL # Agile and scrum environment  WHY US ?  PALO IT is a learning company guided by the values of Agility and craftsmanship offering you multiple possibilities to express yourself and enhance your skills through :  # Our monthly BarCamps; # Our R&D projects; # Our Practices (Development, Architecture, Lean & Agile, Big Data); # Our missions high added value missions in France and internationally that will make you discover new horizons; # Our participation to and sponsoring of major technical events; # And our parties parties = FUN !  Firmly focusing on international expansion, we have offices in France, Hong Kong, Singapore and Mexico, meet us to continue this growth !  If you like what you just read, we’d love to have a chat with you!","Requirements✔ Strong interest in Cloud-based technologies and Devops practices  ✔ 0-2 year (s) of experience in configuration and maintenance of existing Cloud solutions  would be considered a plus  ✔ Experience in migration from Solaris to RHEL (Red Hat Linux) would be considered a plus  ✔ Bachelor’s degree in Computer Science or related area is required  ✔ Certification in AWS/Azure would be considered a plus  ✔ Excellent interpersonal, oral/written communication and cross-group collaboration skills  ✔ Independent thinker with strong work ethic but also willing and able to conform to  established architectural constraints  ✔ Detail oriented with good organizational skills  ✔ Good knowledge of Linux OS, Shell Scripting and SQL  ✔ Good understanding of networking would be a plus  ✔ Ability to work on multiple priorities and/or projects simultaneously  ✔ Problem-solving abilities and ability to meet reasonable deadlines  ✔ Strong team player, ability to build positive and collaborative relationships  ✔ Ability to work under general supervision  ",https://www.mycareersfuture.sg/job/infrastructure-engineer-junior-devops-palo-singapore-bd40723304ad998e0112172698ed087a,Central,Government support available
209,"Key Account Manager ($3500 – 5500, 5 Days, River Valley)",MACHSPEED HUMAN RESOURCES PTE. LTD.,Permanent,Executive,"Information Technology, Sales / Retail ","$3,500to$5,500",Monthly,"Key Account Manager ($3500 – 5500, 5 Days, River Valley) A leading system integrator company which offers IT services and solutions for Big data, cloud, network infrastructure and security. Job Responsibilities :   Responsible to review client project deliverables are align with requirement Resolve client issues and ensure project is delivered within corporate guidelines Work closely with project team throughout project delivery process Cultivate, generate and grow relationships for new and existing accounts Build and maintaining client relations and develop innovative and tailored sales strategies Responsible for quarterly sales quota achievement and project(s)’ profitability Recommend to suitable technology to clients, follow-up and provide viable solutions Report to management of weekly activities and the status.    ","RequirementsJob Requirements :   2-5 years of customer account management experience in IT service consultation industry with solid track record Prior experience in direct selling of information technology services and products Good verbal and written communication skills, independent and proactive Excellent negotiation skill and  ability to handle stressful situation under tight deadlines    We thank you for your interest in this position, applicants with relevant experience please send Microsoft word resume with expected salary to apply@machspeed.com.sg for faster processing, alternatively, please visit https://www.facebook.com/MachspeedHR for more jobs available, thank you. You may also call +6563362530 (Look for BingCheng) to find out more Thank you very much.       Agency License No. 12C6200 EA Registration No: R1437671",https://www.mycareersfuture.sg/job/key-account-manager-machspeed-human-resources-ec51dd45f0317b771a21d7a61c27ecf3,Central,
210,DevOps Engineer,TOOKITAKI HOLDING PTE. LTD.,Permanent,Middle Management,Engineering,"$7,000to$12,000",Monthly,"Introducing Tookitaki Tookitaki is providing machine learning-powered enterprise solutions to address regulatory compliance problems in the financial services sector. Incorporated in November 2014 in Singapore, the company is led by a core team with cumulative 30-years’ experience in finance, AI and big data analytics. Backed by institutional investors such as Jungle Ventures and Spring Seeds (a subsidiary of the Singapore Government), the company’s accolades include:  We are among the selected 21 companies which got accreditation from the government of Singapore for their stringent technology, finance and operations due diligence (www.imda.gov.sg/industry-development/programmes-and-grants/startups/accreditation-at-sgd) We won the first place in the MAS FinTech Awards (Singapore SME) in the regulatory compliance space from the Monetary Authority of Singapore for our approach to make the workflows in AML and Reconciliation scalable and highly auditable (beyond ML based black box approach) (www.mas.gov.sg/News-and-Publications/Media-Releases/2016/Ten-FinTech-companies-recognised-for-innovative-solutions-at-inaugural-FinTech-Awards.aspx) We are voted as one of the top 21 AI start-ups focusing on the financial services space by medici (www.letstalkpayments.com/medici-top-21-ai-companies/) We graduated from Nomura's corporate innovation program in November 2017 where we successfully delivered our product – Reconciliation Management Suite – in a pilot environment (https://inc42.com/buzz/nomura-voyager-fintech-accelerator-voyager-demo-day/)  In regulatory compliance, we focus on anti-money laundering and reconciliation and our products – Alerts Management Suite (AMS) and Reconciliation Management Suite (RMS) – cater to these areas, respectively. The mission or goal is to achieve 40% operational efficiency with significant savings in infrastructure and operational costs.   Tookitaki's unique selling proposition (USP) is in our approach where we combine our proprietary modelling technique with our complete auditable framework to make the process dynamic and highly explainable (moving out of the black box approach). Moreover, our flexible on-premise and cloud-packaging capabilities, along with the option of easy integration to exiting core-banking applications (REST API end points), make the solution deployment faster with lesser barrier to entry. Today, regulatory compliance processes have become more complex and fluidic, increasing the chances for rule-based models to fail. Banks need to move beyond static rule-based systems and adopt a new approach to prevent financial and reputation loss. Tookitaki bridges the gap with its innovative software products – AMS, RMS and PMS.  ","RequirementsRole: DevOps Engineer Location: Singapore              Engineering @ Tookitaki The engineering team is responsible for building a robust predictive platform, which can add significant value to the BFSI vertical in solving operational and compliance risk problems. We take pride in building the system right and continuously evolving it. You have the freedom to choose right tools for the task. We encourage our engineers to participate in and contribute to open-source communities. Our Ideal Candidate Our engineering team is looking for We are looking for a Senior DevOps engineer to join the engineering team and help us automate the build, release, packaging and infrastructure provisioning and support processes. The candidate is expected to own the full life-cycle of provisioning, configuration management, monitoring, maintenance and support for cloud as well as on-premise deployments.  5-plus years of DevOps experience managing the Big Data application stack including HDFS, YARN, Spark, Hive and Hbase Deeper understanding of all the configurations required for installing and maintaining the infrastructure in the long run Experience setting up high availability, configuring resource allocation, setting up capacity schedulers, handling data recovery tasks Experience with middle-layer technologies including web servers (httpd, ningx), application servers (Jboss, Tomcat) and database systems (postgres, mysql) Experience setting up enterprise security solutions including setting up active directories, firewalls, SSL certificates, Kerberos KDC servers, etc. Experience maintaining and hardening the infrastructure by regularly applying required security packages and patches Experience supporting on-premise solutions as well as on AWS cloud Experience working with and supporting Spark-based applications on YARN Experience with one or more automation tools such as Ansible, Teraform, etc Experience working with CI/CD tools like Jenkins and various test report and coverage plugins Experience defining and automating the build, versioning and release processes for complex enterprise products Experience supporting clients remotely and on-site Experience working with and supporting Java- and Python-based tech stacks would be a Plus  Desired Non-technical Requirements  Very strong communication skills both written and verbal Strong desire to work with start-ups Must be a team player  Job Perks  Attractive variable compensation package Flexible working hours - everything is results-oriented Opportunity to work with an award-winning organization in the hottest space in tech - artificial intelligence and advanced machine learning ",https://www.mycareersfuture.sg/job/devops-engineer-tookitaki-holding-feb1cd2dfc93dc463f36ce09e19dd3be,Central,Government support available
211,Back-end Engineer,TOOKITAKI HOLDING PTE. LTD.,Permanent,Middle Management,Engineering,"$7,000to$15,000",Monthly,"Introducing Tookitaki Tookitaki is providing machine learning-powered enterprise solutions to address regulatory compliance problems in the financial services sector. Incorporated in November 2014 in Singapore, the company is led by a core team with cumulative 30-years’ experience in finance, AI and big data analytics. Backed by institutional investors such as Jungle Ventures and Spring Seeds (a subsidiary of the Singapore Government), the company’s accolades include:   We are among the selected 21 companies which got accreditation from the government of Singapore for their stringent technology, finance and operations due diligence (www.imda.gov.sg/industry-development/programmes-and- grants/startups/accreditation-at-sgd)   We won the first place in the MAS FinTech Awards (Singapore SME) in the regulatory compliance space from the Monetary Authority of Singapore for our approach to make the workflows in AML and Reconciliation scalable and highly auditable (beyond ML based black box approach) (www.mas.gov.sg/News-and-Publications/Media- Releases/2016/Ten-FinTech-companies-recognised-for-innovative-solutions-at- inaugural-FinTech-Awards.aspx)   We are voted as one of the top 21 AI start-ups focusing on the financial services space by medici (www.letstalkpayments.com/medici-top-21-ai-companies/)   We graduated from Nomura's corporate innovation program in November 2017 where we successfully delivered our product – Reconciliation Management Suite – in a pilot environment (https://inc42.com/buzz/nomura-voyager-fintech-accelerator-voyager- demo-day/) In regulatory compliance, we focus on anti-money laundering and reconciliation and our products – Alerts Management Suite (AMS) and Reconciliation Management Suite (RMS) – cater to these areas, respectively. The mission or goal is to achieve 40% operational efficiency with significant savings in infrastructure and operational costs. Tookitaki's unique selling proposition (USP) is in our approach where we combine our proprietary modelling technique with our complete auditable framework to make the process dynamic and highly explainable (moving out of the black box approach). Moreover, our flexible on-premise and cloud-packaging capabilities, along with the option of easy integration to exiting core-banking applications (REST API end points), make the solution deployment faster with lesser barrier to entry. Today, regulatory compliance processes have become more complex and fluidic, increasing the chances for rule-based models to fail. Banks need to move beyond static rule-based systems and adopt a new approach to prevent financial and reputation loss. Tookitaki bridges the gap with its innovative software products – AMS, RMS and PMS.  ","RequirementsRole: Backend Developer (Recon/AML) Location: India Engineering @ Tookitaki The engineering team is responsible for building a robust predictive platform, which can add significant value to the BFSI vertical in solving operational and compliance risk problems. We take pride in building the system right and continuously evolving it. You have the freedom to choose right tools for the task. We also encourage to participate in and contribute to open source community. Our Ideal Candidate Our engineering team is looking for a backend engineer with 2+ years of experience. He/She would be responsible for contributing to product development and would be considered a good fit if he/she:   Ships high-quality code and believe in TDD   Has deep experience with one or more programming languages such as Java, Scala and Python   Has experience designing micro-services or service-oriented architectures   Has experience working with and understanding of Relational Databases   Has experience working with one or more cloud providers, preferably AWS   Enjoys digging into open-source projects and contributing back   Is well versed with tools of the trade – Git, IDEs and build tools   Has a keen desire to learn and grow The candidate would stand out if he/she has:     Prior experience with one or more distributed NoSQL stores   Prior experience with Hadoop and Spark ecosystem Educational/Professional Requirements     A Bachelor’s/master’s degree in computer science or related discipline from reputed institutions   Relevant work experience of 2-5 years Job Perks     Attractive variable compensation package   Flexible working hours - everything is results-oriented   Opportunity to work with an award-winning organization in the hottest space in tech -   artificial intelligence and advanced machine learning  ",https://www.mycareersfuture.sg/job/back-end-engineer-tookitaki-holding-97b781899403c9eb3c1b44838212e50a,Central,Government support available
212,Senior Solution Architect,TOOKITAKI HOLDING PTE. LTD.,Full Time,Middle Management,Engineering,"$9,000to$15,000",Monthly,"Introducing Tookitaki Tookitaki is providing machine learning-powered enterprise solutions to address regulatory compliance problems in the financial services sector. Incorporated in November 2014 in Singapore, the company is led by a core team with cumulative 150-years’ experience in financial crime, AI and big data analytics. Backed by institutional investors such as Jungle Ventures, Illuminate Financial and Enterprise Singapore (a subsidiary of the Singapore Government), the company’s accolades include:  We are among the selected 21 companies which got accreditation from the government of Singapore for their stringent technology, finance and operations due diligence (www.imda.gov.sg/industry-development/programmes-and-grants/startups/accreditation-at-sgd) We won the first place in the MAS FinTech Awards (Singapore SME) in the regulatory compliance space from the Monetary Authority of Singapore for our approach to make the workflows in AML and Reconciliation scalable and highly auditable (beyond ML based black box approach) (www.mas.gov.sg/News-and-Publications/Media-Releases/2016/Ten-FinTech-companies-recognised-for-innovative-solutions-at-inaugural-FinTech-Awards.aspx) We are voted as one of the top 21 AI start-ups focusing on the financial services space by medici (www.letstalkpayments.com/medici-top-21-ai-companies/) We graduated from Nomura's corporate innovation program in November 2017 where we successfully delivered our product – Reconciliation Management Suite – in a pilot environment (https://inc42.com/buzz/nomura-voyager-fintech-accelerator-voyager-demo-day/)  In regulatory compliance, we focus on anti-money laundering and reconciliation and our products – Anti-Money Laundering Suite (AMLS) and Reconciliation Suite (RS) – cater to these areas, respectively. The mission or goal is to achieve 40% operational efficiency with significant savings in infrastructure and operational costs.   Tookitaki's unique selling proposition (USP) is in our approach where we combine our proprietary modelling technique with our complete auditable framework to make the process dynamic and highly explainable (moving out of the black box approach). Moreover, our flexible on-premise and cloud-packaging capabilities, along with the option of easy integration to exiting core-banking applications (REST API end points), make the solution deployment faster with lesser barrier to entry. Today, regulatory compliance processes have become more complex and fluidic, increasing the chances for rule-based models to fail. Banks need to move beyond static rule-based systems and adopt a new approach to prevent financial and reputation loss. Tookitaki bridges the gap with its innovative software products – AMLS and RS.","RequirementsRole: Senior Solution Architect               Our Ideal Candidate Tookitaki’s engineering team is looking for a smart candidate for the position of Senior Solution Architect. The candidate’s roles and responsibilities will include:  Working with customers during the sales process to prepare customer and Client Delivery for an engagement Actively partnering with sales for closing deals Being the sole technical contact for client (be technical expert, not coordinator) Communicating with product management on customer needs & problems Conducting technical deep-dive sessions with prospects Exercising expert knowledge of Tookitaki products and their integration into many diverse financial institutions Exercising good knowledge of AI/ML and financial crime Assessing, managing and mitigating technical challenges with customer IT environments Ensuring technical feasibility of intended solution Advocating for customer's needs within Tookitaki; ensuring client expectations exceeded Occasionally assisting client delivery or perform pre-sales consulting Occasionally conducting training for clients or partners Working in a collaborative environment with other solution architects  Skillsets and Experience (must-have)  5+ years’ experience as any of: systems integrator, software architect, senior data scientist, enterprise architect 3+ years’ customer-facing experience Familiarity with AI/ML Experience with Linux, Python, JSON/XML, SQL Experience with ETL Strong English communications skills - verbal, written, presentation Clean record from background check  Preferred Requirements  Knowledge of financial crimes (AML, fraud) and banking Experience creating and testing a ML model Experience working with and supporting a sales organization Experience as systems integrator  Travel Requirements    Up to 50% Must be able to travel to Europe, the US, Singapore and more  Selection Process The candidate will be asked to (1) provide a technical writing sample (document), (2) conduct a conference call presentation for 15-20 minutes on a topic of the candidate's choosing (preferably an AI project) with 10 minutes of Q&A, and (3) write a simple Python program for ETL. Job Perks  Attractive variable compensation package Flexible working hours - everything is results-oriented Opportunity to work with an award-winning organization in the hottest space in tech - artificial intelligence and advanced machine learning ",https://www.mycareersfuture.sg/job/senior-solution-architect-tookitaki-holding-5f824c05e10766926246fa69c722be54,Central,Government support available
